Name,Message,TimeInSeconds
Jada H.,checking in from italy,5
Brandi A.,checking in from colombia,8
Tara S.,ready to be fired up lets go,10
Lilian K.,yeah let's see the cutting edge stuff,34
Lilian W.,i want to tap into trends,36
James X.,how can we run a 20k ai agency?,37
Modupe X.,yes very excited,45
Michelle A.,ai instagram sounds crazy,50
Ayo R.,checking in from dublin,55
Latoya I.,i hope this ben murray is legit,59
Carolyn N.,yes,65
Brooke N.,sounds great,72
Felicia Y.,yes,76
Brianna G.,yes,80
Lakesha Q.,lets see what this is all about,86
Alexandria X.,hello world checking in from paris,91
Chelsea I.,ai agents?,96
Daniel O.,yes,107
James Y.,yes,108
Thomas W.,i'm ready checking in from california,110
Diamond X.,yes,111
Carolyn N.,gonna type yes also for everyone,141
Kayla K.,gonna make that money,143
Talia P.,so addicted lol,144
Fatimah L.,lets do it,156
Fatimah S.,must have cutting edge ai marketing training,172
Breanna U.,yes,173
Joy K.,yes excited is an understatement,176
Shayla L.,yes,177
Chelsea A.,yes,182
Breanna R.,yes,185
Nicole J.,revolution in marketing,195
Alexis D.,lets be excited together,196
Robert Y.,checking in from boston,199
Alexandria R.,checking in from sweden,199
Jada G.,yeah i'm ready to crush it,210
Lisa A.,yes,219
Lisa K.,checking in from canada,229
Kirsten E.,meta approved ai stuff?,230
Crystal Z.,checking in from kuwait,236
Brianna M.,checking in from hungary,244
Sierra Q.,lets build that brand,255
Matthew B.,checking in from romania,264
Shantel E.,checking in from seattle,272
Nicole M.,checking in from spain,280
Michelle K.,thanks for the message from jen,286
Haven Y.,checking in from austria,298
Anthony B.,checking in from mexico city,301
John N.,checking in from kenya,301
Chelsea Y.,yes cant wait here,303
Kendra U.,ok lets get that training now,307
Kiara P.,need this ai stuff,315
Latrice H.,i hope we get some real meat in this training,319
Kayla W.,ok excited about this,330
Angelica W.,yes,335
Blessing F.,i'm fired up now,336
David D.,type yes now if you're ready to go,346
Veronica J.,checking in from japan,355
Matthew W.,checking in from czech republic,361
Charles L.,type yes now if you're ready to go,363
Alexis J.,yes lets see this now,363
Joy Q.,checking in from new zealand,364
Erica W.,checking in from denver,369
Carolyn D.,yes,383
Jasmine J.,i'm excited about this,400
Veronica H.,i want the cutting edge stuff love it,400
Toni P.,live from dallas texas,413
Ayo S.,yeah I'm addicted to social media,417
Sierra A.,wow i can't believe we are finally learning ai,418
Brooke K.,lets do this,439
Kayla D.,checking in from singapore,442
Brianna P.,this jen sounds like me,442
Daniel L.,i'm in,443
Hauwa K.,ai agent lets go,445
Brianna B.,thanks,449
Jasmine M.,awesome,461
Tara S.,lets do this excited for this,471
Latoya O.,i want to make some passive income,472
Michelle A.,type yes now if you're ready to go in the chat,480
Ashley N.,checking in from south africa,487
Kierra O.,yes,487
Melanie X.,checking in from taiwan,497
Breanna Z.,type yes now if you're ready to go now,501
Tiffany Z.,he said something about magical genies haha,502
Modupe O.,i want to retire my wife also,514
Matthew Q.,yes time to go,516
Kayla K.,sounds great ready for this,518
David M.,that sounds like a movie lol,524
Kiara J.,type yes now if you are ready to go,528
Brianna F.,i don't want to get automated away,530
Diamond Z.,yes,538
Joy R.,ok i'm ready,543
Ese Y.,okay type yes awesome,545
Latrice Y.,ben lets go,546
Latoya D.,ok ready to go,547
Kierra C.,checking in from ohio,548
Jasmine Q.,cant wait need this ai stuff,548
Tiffany Z.,yessir lets go,553
Deandra W.,checking in from ghana,558
Matthew L.,checking in from nigeria,560
William A.,ready to get that AI training now,560
Melanie L.,yes,564
Michelle H.,yes,569
Jada P.,ben i'm ready to go,575
Ayo C.,yes,578
Fatimah D.,that intro music was pretty cool,592
Chelsea S.,checking in from saudi arabia,600
Grace T.,i need a system something i can actually use,610
Melanie S.,yes,612
Kierra T.,yes,613
Fatimah L.,cant wait awesome lets learn it,616
Chelsea B.,that's a lot of yeses lol,619
Kayla L.,ok the genie is the new team member,620
Brandi C.,amazing stuff,630
Anthony Q.,i want a faceless channel business,645
Ese F.,checking in from philippines,650
Diamond C.,must have training on how to build these channels,650
Ashley W.,yes ready to go,672
Felicia S.,yes,676
Alexandria W.,type yes now if you're ready to go,679
Brooke V.,lets see these agentic agencies,701
Lisa Y.,yes,703
James S.,lets make this the year,710
Thomas K.,checking in from london uk,718
Stephanie P.,amazing can't wait,718
Breanna O.,yes,719
Michael M.,time to put those phones away lol,720
Anthony Q.,live from miami,723
Stephanie M.,live from san diego,726
Melanie O.,checking in from ukraine,727
Brittany N.,awesome,750
Nicole S.,checking in from amsterdam,752
James D.,great lets go,754
Alexis Y.,yes,756
Chelsea Z.,yes,761
Kierra E.,attention economy,766
Toni C.,excited for this opportunity lets go,768
Ashley O.,this is what i need,769
Anthony D.,type yes now if you're ready to go,769
Lilian L.,yes,773
Daniel U.,so excited awesome work lets go,773
Grace Z.,time to sign up,774
Angelica W.,yes awesome cant wait,794
Blessing P.,ready to take some notes,799
Dominique W.,checking in from dubai,815
Daniel N.,yes lets see this stuff,815
William Q.,okay excited ben,815
Anthony J.,let's go this sounds amazing,817
Michelle G.,wow jen went from stuck to exploding,821
Charles X.,yes,822
Jada N.,checking in from germany,837
Michael Y.,my phone is silenced,839
Samantha J.,yes,843
James P.,yes lets do it now,856
Alexis B.,i'm ready,861
Brittany W.,yes,880
Grace B.,yes this is amazing,887
Jada O.,i'm a total newbie,889
Chelsea A.,yes cant wait,895
Nicole M.,checking in from scotland,901
Breanna N.,must have ai marketing training,902
Joseph R.,yes checking in from my kitchen,903
Lisa Z.,yes,907
Nicole S.,yes,912
Stephanie Y.,finally something real,924
Fatimah N.,that ai girl sounded great,931
Veronica H.,ok good point old school marketing is gone,934
Carolyn M.,yes awesome let's go i'm ready,945
Modupe L.,can't wait lets crush this,951
Lakesha I.,awesome lets go crushing it now,954
Deandra Y.,yes,956
Olivia O.,yes,970
Samantha H.,i hope this works,980
Krystal H.,yes,984
Ese T.,ai is the future,995
Thomas G.,ready for this ai cutting edge knowledge,1005
Ashley K.,checking in from israel,1007
Fatimah X.,sounds great so excited for all this,1011
Veronica N.,yes,1014
Samantha P.,awesome lets go,1040
Joseph G.,yes,1043
Jazmine H.,need to win in this new era,1051
Lakesha O.,yes,1054
Brooke O.,yes,1055
Ayo M.,let's go,1056
Angelica T.,checking in from thailand,1056
Stephanie J.,type yes now lets learn all this stuff,1056
Veronica A.,amazing stuff this ai stuff,1057
Kendra L.,checking in from brazil,1062
Latoya V.,checking in from south korea,1064
Crystal R.,excited here,1067
Daniel Z.,yes,1077
Robert L.,yes,1084
Nicole N.,i want to have 15k a month,1087
Haven T.,yeah cant wait,1089
Grace V.,yes,1091
Hauwa C.,yeah I check social media,1099
Angelica U.,yes,1105
Lisa B.,ok lets do this now,1109
Michael H.,yes,1117
Michelle S.,lets get that cutting edge stuff,1120
Haven A.,yes,1143
Alexis Z.,yes,1148
Jazmine V.,checking in from florida,1156
Thomas Q.,type yes now if you're ready to go now,1160
Modupe W.,checking in from belgium,1165
Toni S.,lets do this awesome,1168
Hauwa B.,ok lets see the system,1169
Haven S.,yes lets get this bread,1177
Daniel V.,yes,1186
Breanna G.,i'm going to get that aff monetization system,1188
Shayla R.,yes,1193
Matthew T.,that intro from jen was amazing,1195
Robert B.,so ready type yes now lets get it,1195
David L.,yes,1206
Latrice E.,hello everyone checking in from austin,1212
Felicia I.,type yes now if you're ready to go,1212
Kierra J.,checking in from vietnam,1219
Brandi X.,checking in from egypt,1232
Crystal F.,ai agents now,1236
James X.,yea i want to dominate,1238
Grace S.,gonna make this a success,1248
Kayla Z.,checking in from portugal,1250
Breanna S.,yes,1258
Kiara Q.,checking in from my bathroom because it is silent in here lol,1263
Blessing C.,yes,1267
William D.,yes,1273
Michelle I.,can't wait awesome love these offers,1276
Ashley D.,yes,1281
Matthew J.,yes,1286
Latrice O.,yes,1289
Jazmine W.,david exactly what I'm thinking,1291
Jasmine C.,yes,1301
James S.,checking in from argentina,1311
Alexis E.,i need this ai system,1320
Brandi P.,checking in from nyc,1328
Stephanie D.,yes,1350
Samantha A.,ok so eight figure ai huh,1355
Alexandria M.,type yes now if you're ready to go,1361
Kierra D.,checking in from venezuela,1375
Daniel E.,ok time to win,1376
Veronica U.,yes so fired up,1378
Kirsten P.,let's get this free time,1383
Diamond Z.,yes,1384
Robert O.,this is where it's at,1386
Modupe X.,checking in from poland,1387
Jazmine J.,type yes now if you're ready to go,1390
Kayla U.,checking in from kansas,1398
Jasmine O.,dominating the attention economy,1404
Anthony I.,yes,1414
Anita K.,yeah let's win at business,1419
Brittany L.,checking in from chicago,1422
Breanna Z.,this is the year i make it work,1422
Fatimah R.,live from los angeles,1432
Melanie J.,checking in from india,1434
Lakesha X.,so here we go its time,1440
Kayla O.,lets get it lets get it,1443
Stephanie A.,right here,1455
Brandi X.,yeah okay lets do it,1465
Breanna Y.,ok i want to see,1468
Dominique G.,so whats up?,1472
Breanna K.,yeah,1472
Angelica I.,so you land and then sell,1484
Destiny S.,yeah ok lets go now haha,1501
Nicole F.,wow jen has kids,1503
Deandra I.,wow ok lets learn,1505
David B.,yes ready,1509
Toni F.,no way,1516
Modupe N.,great point,1531
Olivia W.,ok ok lets get to work,1548
Talia I.,ok thats great,1558
Toni I.,case study,1559
Latoya D.,you need to make it real people,1561
Grace R.,okay here it comes,1588
Alexandria S.,ok here it comes,1592
Tara K.,yes here and ready,1597
Deandra R.,ok i wanna know,1602
Shantel T.,wow lets go,1603
Stephanie M.,so if you want them you know what is a thing?,1606
Veronica H.,lets get to it,1609
Jada O.,wow sounds unreal,1627
Modupe S.,this is not new,1636
Kayla W.,that's right,1639
Ayo O.,ok so awesome stuff,1647
Anita Z.,so here is how beginners learn,1653
Joy O.,holy cow,1667
Deandra L.,i want to get some,1669
Robert M.,yes this is amazing,1685
Olivia P.,ready to learn,1688
Robert P.,ready for the value drop,1701
Anthony P.,wow,1709
William D.,alright value to see!,1710
Carolyn E.,okay great points,1729
Brooke P.,wow all this is awesome,1738
Brittany E.,wow,1742
Brooke J.,ready to go,1744
Brittany G.,lets go here,1744
Brooke K.,lets learn it now,1755
Alexandria M.,wooo lets go,1760
Krystal C.,okay lets get the value!,1761
Anita Y.,yeah this is good!,1763
Lisa U.,that amazing,1772
Alexis S.,thats it,1785
Brianna R.,totally ready,1787
Breanna O.,here,1788
Dominique I.,not some stuff,1791
Amanda H.,yeah,1791
Robert M.,living instagram channels,1796
Felicia L.,time to learn the truth,1796
Ayo B.,no bots or anything else,1800
Deandra P.,do it,1803
Kendra B.,ok here we go,1816
Brooke N.,ready now!,1829
Ese Q.,yeah so ready to go now,1835
Ayo E.,haha cool lets get some value,1861
Carolyn I.,love it all,1864
Nicole C.,alright!!,1875
Tiffany T.,yes to this,1877
Samantha C.,ok so its pretty awesome,1884
Brandi Q.,wow,1890
Destiny I.,okay i am ready for it,1895
Latoya A.,haha finally the value drop here!,1902
Kiara Z.,wow,1917
Lisa A.,lets get to it,1925
Erica I.,i am here and ready to go,1934
Sierra N.,they do a thing,1935
John Z.,immediately you are not held back,1940
Joseph L.,ok no more selling lol,1944
Grace C.,all this is awesome,1959
Crystal E.,wow here we go,1959
Anthony T.,turn it off,1964
David D.,no way lets get to value,1971
Robert Y.,ok so here we go,1972
Anthony R.,yes here now,1991
Brianna N.,yes lets go,1992
Joseph S.,totally get it,2006
William K.,its a good point,2008
Tiffany L.,this is all amazing stuff,2017
Deandra R.,amazing love this!,2021
Lilian F.,wow ok i need to see,2029
Erica V.,ok great intro,2049
Latrice W.,this is so good!!!,2050
Amanda T.,yeah now the real stuff here,2066
Anthony Y.,yes,2078
Michelle N.,ready to go,2079
Charles J.,so what are you getting here?,2088
Angelica N.,its important,2089
Samantha J.,yes i am,2094
Shayla V.,ok here we go,2095
Joseph C.,value time yeah!,2096
Kierra J.,great i am in,2098
Latrice T.,yes lets learn,2103
Latrice A.,time to make money!!!,2107
Brandi M.,ok lets find out,2112
Destiny S.,ok so no more selling now lol,2113
Angelica R.,i wanna go,2117
Nicole N.,wow that is awesome,2122
Blessing M.,lets do it lets learn,2131
Kierra L.,ok lets go,2156
Modupe X.,ready,2156
Latrice Q.,and if you want the done for you one dont have one thing to sell what is that thing,2168
Hauwa N.,yeah lets go,2186
Erica K.,holy wow,2193
Ayo M.,totally taking notes,2196
Blessing E.,totally,2217
Tiffany O.,lets all sign it up,2221
Lilian S.,i will take some notes,2242
Jasmine E.,sounds awesome,2249
Ashley T.,yes amazing stuff,2251
Thomas T.,okay now lets get to it!,2253
Anthony B.,the last thing is key,2276
Breanna U.,yes i am taking notes,2290
Kiara Y.,i am all eyes and ears,2294
Lakesha E.,he has the energy,2301
Anthony Y.,yes great point,2306
Amanda C.,yeah! good stuff,2318
Michelle K.,yes,2324
Charles C.,okay okay lol,2328
Ashley H.,i will get a pen and notepad now haha,2336
Lakesha P.,yeah now we get some real value,2366
Lisa X.,yes and very hyped,2379
Talia K.,yeah okay good i need to see,2382
Michael F.,ok okay here we go now,2388
Krystal K.,lets get down to earth,2390
Jasmine D.,this is the first one,2400
Carolyn O.,thanks will get a new direction,2404
Alexandria E.,amazing! this is so great,2426
Ayo G.,i will take good notes,2437
Tara R.,yes lets learn it!,2446
Erica W.,yeah i am excited,2454
Alexis A.,here we go!,2455
Brooke Q.,its new stuff here,2458
Chelsea T.,i get it,2477
Samantha B.,yes lets see it all,2515
Ashley O.,lets go yes,2520
Ashley T.,no way i want to see more,2522
Fatimah P.,wow its legit,2525
Shantel F.,ok lol now we get the value,2531
Kendra Z.,yes,2543
Diamond A.,i gotta see this,2546
Joseph T.,its simple,2550
Grace L.,diane totally feel the same!,2558
Kendra S.,lets do it,2575
Deandra D.,yes love to see it,2577
Latrice T.,so you will too,2581
Carolyn V.,lets go,2583
Michelle R.,this is all new by the way,2591
Modupe J.,ok lets go,2595
Shantel A.,so yes,2610
Shayla R.,cool stuff ok,2618
Daniel B.,ok ok value time,2621
Brooke Z.,ok ok here we go,2632
Latoya B.,getting all the value,2636
Melanie V.,four steps,2642
Kiara P.,lets get to work!,2648
Felicia N.,this is incredible stuff,2659
Kenya H.,me too taking notes here,2664
Lakesha D.,ok so lets go,2670
John R.,wooo,2675
Alexis X.,ok ready to write,2682
Kierra I.,yes,2708
Rhonda G.,i am in lets go now,2710
Amanda U.,its so important for me!,2713
Fatimah M.,yes yes,2714
Rhonda Z.,ready,2715
Blessing H.,yeah ok lol this is good info,2720
Haven W.,i am here for the meat and potatoes,2734
Deandra J.,that is awesome,2739
Rhonda P.,haha alright,2743
Kirsten H.,yeah,2750
Thomas H.,i am here and excited,2751
Daniel E.,good ok all this is neat,2755
Angelica X.,ready and waiting,2758
David Y.,so get some,2762
William C.,its time to learn it!!!,2766
Robert A.,ok ready to learn,2778
Ashley X.,yes lets go,2784
Robert E.,ok ok i am gonna take notes here,2786
Blessing T.,some cases are a lot easier,2793
Destiny M.,yeah good stuff lets take notes,2808
Deandra F.,totally with you,2816
Brandi A.,cool to see it,2835
Dominique E.,love it ready to see,2841
Hauwa U.,no matter where you are,2843
Brittany T.,wow,2855
Shayla K.,no excuses!,2871
Latrice K.,you get white label rights to dominate the attention economy playbook a cutting edge training that breaks down the newest algorithms content formats and growth levers shaping instagram to give away to get your foot in the door for potential clients get a gorgeous day and night link in bio website uh this is huge obviously for instagram essential for directing followers to your offers funnels and content you can sell this as well total value is eighteen hundred dollars for this and the price is one twenty seven per year thats what everyone's going to be buying it to get access but you don't have to pay that because you came on this special call,2887
Michelle M.,if your dog's tummy has been acting up skin issues itching or just feeling off,2898
Rhonda G.,and tons of people using ai to automate their instagram business lucas started a faceless business around a topic he's passionate about and now it makes three k a month with almost a hundred k followers now,2905
Brandi Q.,now you're getting another upgrade called gram genies elite and this includes the international license and technology now so you can create push button instagram social media video content in all major languages and target users who speak any language not just english so only a few marketers are doing this they've extra their traffic and sales expanding into low competition international markets this includes the license to create and sell campaigns in anywhere too now,2942
Destiny E.,and it's our job to catch it early,2949
Matthew A.,you also get the ability to create unlimited ai social posts create unlimited ai videos now unlimited instagram automations schedule unlimited posts to unlimited accounts connect unlimited accounts you'll be able to render videos in full hd now get premium video rendering time and vip gold bonuses inside the members area total value for this two thousand dollars and everyone's buying it for one ninety seven per year but dont worry you don't have to pay that price at all,2949
Dominique E.,if you want real muscle growth not wishful thinking,2950
Chelsea T.,it's called paubiotics and it's the only probiotic we recommend for,3034
Haven H.,you also get white label instagram client assets ready to plug and play instead of having to create all the content yourself and post what if we just do it for you and thats exactly what you're getting with these white label done for you instagram client assets uh you'll get tons of ai content with gorgeous high engaging images ready to just upload to your client's account and schedule right away,3039
Jada L.,plus you're going to get three bonus apps that are created by us and fit great with gram jeannie's including gram jeannie's rank reel unlimited access now this is a separate app from gram jeannie's but is a five in one comprehensive video ranking solution that gets you or your client's videos to page one of google and youtube this year and beyond so you can actually rank these videos that you um come out with not just on instagram but on youtube google even get them in ai search suggestions with this special app total value for this eight hundred bucks everyone's buying it for ninety seven dollars per year,3069
Blessing A.,and the second you actually follow them your physique starts changing fast,3097
Latoya M.,uh gary how would i buy this uh just hold on uh so whats awesome is you can have agentic ai essentially do everything for you so its very tech friendly beginner friendly or theres detailed customization for those who like to customize and tweak everything so everyone can win big with this,3174
John V.,uh there's even more features so no stone is left unturned to have success and of course you can tell this wasn't thrown together in the last few months,3177
Lilian D.,people writing in like ross he said ive been real impressed with your stuff in the past so set me set aside uh some time to give the instagram agent to try we set up three faceless channels uh plus plug gram genies into an old instagram account that had stalled things are going really well ones crossed a hundred k followers already and is earning every day we haven't even started heavy monetization yet so thats going to be fun awesome job on making social scalable man,3196
Talia P.,uh we've been working on this for a long time had to submit it to meta,3221
Charles V.,now every other business i tried before basically failed because nobody nobody ever saw my offers,3271
Sierra S.,thanks to gram genies all the hard stuff's gone that was typically associated with building a long-term ethical business that properly services customers lets you work only a few hours each week living life how you want,3275
Lakesha I.,uh plus get white label rights to our demos swipes sales material to help land them as well you also get the tma access so the team members access feature allows you to create access to gram jeannie's for your team members or vas this allows them to log in automate tasks so now you can have ai agents plus cheap freelancers fully automate this business turn it into what i call a tablet business where you can just sort of run it from your phone or tablet a hundred percent,3303
Diamond H.,this is the thing that finally worked for us,3366
Kirsten D.,also includes multi copy a multilingual copy in video voiceover tech so enter any keyword and create amazing instagram social posts and videos on any major language thats proven to get leads and sales and even human sounding voiceovers in any language too pick from hundreds of different languages and add multilingual ai voiceovers now,3372
Anita T.,seventy k followers just crossed on my gram jeannie's instagram channel and over twenty five hundred people on my list,3377
John B.,just wanted to shoot a quick video for you because i hit a huge milestone and im feeling super proud,3402
Haven A.,first thing their joints,3410
Daniel C.,you'll get done for you fiverr and upwork gigs you can make back the cost of your purchase fast with these premium templates create instagram materials and campaigns for clients better than everyone else on these platforms including people selling those real videos for seven k plus on fiverr or upwork with millions of potential customers searching for how to do marketing on instagram properly so instagram uh services thats the the highest um uh rising service right now on these places uh there's still not tons of saturation so this is the easiest service to land clients from immediately,3411
Ashley L.,these are the three rules every lifter learns the hard way,3412
Matthew I.,but before and in a few minutes you'll be able to start accessing gram jeannie's to grow your business for you,3414
Joseph W.,so how do i know that gram genies gives you the easiest way to get traffic and run a business in fact the easiest ai business to run well again marketing is switching from direct response old school paper click and funnels to those you can just get attention they call it the attention economy and ai agents are the biggest thing in business right now,3424
Blessing Q.,so first you're getting access to gram genie's premium this is the regular version that you saw in the demo with commercial rights included to sell to clients total value is seven hundred bucks and it will sell for ninety seven dollars per year but you don't have to pay that price at all because you came on this special call,3465
David V.,those little hesitations when they get up thats your cue to go slower on walks add soft bedding maybe even a,3476
Stephanie C.,and i think you get the message by now you get the point uh the results keep going on and on this thing is transforming people's businesses and lives um now in a few minutes from now you're going to be accessing gram jeannie's to grow your business for you too and we try to pack on as many features and value into gram jeannie's in the demo the regular version you saw we did have to leave out some licenses and amazing features to make the software more affordable and accessible to everyone so if you're one of those users interested in using the app to its full potential to save far more time we do have some upgrades available which i'm going to cover right now in this quick video,3527
Brooke V.,and you're also getting gram genie's platinum upgrade now this most advanced edition allows you to keep clients longer with advanced enterprise technology white label the app as your own tap into done for you affiliate offers and more so this one includes the agency white label technology where you can replace the gram jeannie's branding from the dashboard with your own agency's logo and branding and make the app a part of your own agency stand out from everyone else and white label your agency account with your own branding so clients don't log into gram jeanies see our branding and then be like why are we paying this guy fifteen hundred dollars a month we can just you know buy it from ben on the main site for less so this is super important because you don't want uh clients you know leaving you and buying it from us and you get to control uh the pricing positioning lead generation everything now,3536
