Name,Message,TimeInSeconds
Anthony R.,now we tried to pack on as many features and value into gram jeannie's in the regular version that you saw in the demo but we did have to leave out some uh licenses and amazing features to make the software affordable and scalable for everyone so if you're interested in using the app to its full potential to save far more time i do have some upgrades available which i'm going to cover right now but before we jump into those because you came on this early call and we're engaged spent time with us we have a special deal where you can get access to all the upgrades without having to pay the prices everyone else will when they go through our regular funnel with all the upgrades so keep in mind the prices you see below for each upgrade that's what everyone else is paying as they go through our normal sales funnel you don't have to pay that at all so here's what you're going to be getting access to in just a few minutes from now,3539
Sierra L.,most said we run a decent sized agency ive seen a lot of tools come and go most forgettable this impressed me and we added gram genie services to our client offerings with massive uptake clients immediately noticed the difference in engagement follower quality and dm conversations it was undeniable its been so successful that were now seriously considering pivoting to a full instagram attention ai agency because the demand has been that strong huge congrats on creating something that actually moves the needle this is one of the few tools that truly deserves the hype,3566
Breanna B.,uh rod said if you want to be in business going forward you have to grow your social accounts but doing everything manually the right way uh for etcetera posting engaging with followers targeting the right people leads to burnout and generic ai tools don't work gram jeannie's is different because it learns your business and grows your account like a real human team does jump on this one because it's not just another tool it's how businesses will be built going forward,3644
Anita Q.,thanks,3701
William Z.,brenda that had to be the most impressive software i've seen in three years,3734
Jada N.,so combining these things is the best play you can possibly do to survive in fact you don't even need hosting a website a product with this model uh so instagram plus ai agents its the biggest thing that can help you thrive the next several years in business,3772
Jasmine T.,edith said gram genies is working great and going to save us a ton this year we were paying ridiculous amounts every month for ai video tools auto messengers schedulers planners that weren't as good realistically were saving around twenty five k a year now huge thanks to building something that actually lives up to the hype,3785
Chelsea Y.,and guys just know this when you sign up for gram genies soon if you're not happy and succeeding then i'm not happy for any reason you want your money back you can just get it back and all you have to do is go to the support link in the training or at the bottom of the page open up a ticket letting us know why it's just not working and you're not getting results and you're going to get just that and you can only make a guarantee like that when you're a,3794
Charles O.,and if you can believe it that's just a little of what gram genie's is capable of,3865
Kenya D.,getting the traffic just hadn't worked out but with this its been easy,3865
Latrice U.,total value eight hundred bucks price is ninety seven dollars per year and then you're getting gram genie's coincart unlimited special a first to market tech that allows businesses anywhere to sell digital or physical products with cryptocurrency check out fast and easy generate gorgeous sales sites with templates auto deliver products after crypto purchase this transformational tool comes with agency rights allowing marketing companies to set up crypto payments and memberships for fees without having to know anything about crypto this is a red hot service total value eight hundred dollars price is ninety seven dollars per year,3871
John K.,see a lot of exciting comments coming in johnny says im speechless,3889
Matthew S.,you also get as a special uh bonus gram genie's ai repuders unlimited special so ai repuders uh app created by the same team is an ai suite that lands pre-qualified leads with ai claims local business profiles through the app like uh clients google business profile to manage and then grows them with ai auto review technology so this going to help rank local profiles at the top of google search results in what's called the three pack of maps and makes your business get recommended number one in ai search results and this tool is so powerful you can run an ai reputation automation agency with it alongside your instagram agentic agency too,3922
Krystal B.,you also get the ability to remove the powered by gram jeannie's link this appears at the bottom of the content pieces that get made and at the end of videos you make but to get the highest conversion as possible and run a serious business you need to remove that link and branding so we're letting serious elite upgraders do just that get the power by link automatically removed upon creation and post you also get white label instagram client assets ready to plug and play,3998
Brooke Y.,then you're getting the upgrades and the first upgrade is called gram genie's gold this more advanced edition includes the unlimited licensing and advanced features like agency technology and more campaign accounts where you can integrate clients into the app now let your clients log into the app customize the campaigns the way they want give them full control over creating them the way they want and charge for access,4028
Rhonda G.,the agents keep bringing in the right followers and the content actually lands and everything it's finally clicking,4031
Krystal T.,what i love about it is that it's not some crazy stem junk that spikes your heart rate it's,4046
Krystal Y.,all right listen up,4124
Latrice H.,in fact a lot of people for this one actually built profitable instagram faceless businesses i mean we're doing it students are doing it uh people are even using it to like extra their current business even start their own agency in fact some people even send us videos documenting their success so i want to play some of those right now for you,4140
Carolyn B.,plus i'll done for you aic instagram agency scaling bundle skyrocket your agency with essential premon demand materials which includes a premium social agency proposal social media manager presentation legal contracts and more plus vip platinum bonuses you'll see in the members area total value for this is two thousand dollars and everyone's going to be buying it for one ninety seven per year,4154
Melanie C.,but look it's not just that either its just because we're just seeing people do it,4156
Fatimah F.,you also get the ability to add a hundred agency clients and run a hundred full ai agent affiliate campaigns now you'll be able to add far more clients to gram genie software to let them set up the campaigns how they want while you charge a monthly fee for access and you also get high commission affiliate product approval from me with a done for you trained genie on it youre gonna get access to the high commission gram genie's affiliate program with everything done for you ready to make sales with a done for you genie that will be integrated in the account trained on the product ready to start selling it for you so you easily just place your affiliate link in your instagram bio or anywhere else and then we're going to do all the hard work once they click closing the sales getting them on webinars uh just like this,4162
Blessing G.,matt started a faceless side hustle business he's making twenty k a month from his ai news channel uh damon is over five hundred k subscribers for his crypto news channel pumping out automated content,4220
Toni M.,you also get a done for you ai agency services website a fully branded enterprise agency website set up to help sell your service uh one hundred percent for you if needed this website can be customized with your logo and branding giving it a unique and consistent look that reflects your brand and will establish yourself as a credible and authoritative business that clients can feel safe buying from and lets you sell your instagram and social services comes with five years of done for you hosting if needed,4222
Daniel F.,donna thompson really nice ben,4240
Felicia A.,hey i honestly thought i'd never be someone running a business on the side but here we are already past four thousand dollars thanks to gram jenny's you were right i didn't need a huge following at all once the jeans learned the offer i'm promoting they started creating videos and handling dms and answering questions like somebody who knows my business way better than myself so excited to see where this takes me,4258
Samantha X.,hey it's your boy greg and i've been stacking citrus burn with all my workouts to lose fat fast and let me tell you why,4276
Alexis M.,he is so clear this is great,4320
Kierra E.,tony yessssss that's a bag right there,4325
Latrice W.,what is the risk of this tho?,4327
Joseph G.,it took my money and then ran away lol,4335
Charles S.,bro ur scaring me its happening too fast ahhh,4335
Stephanie S.,yeah lets go,4337
Charles F.,what happens after i sign up?,4355
Ashley S.,this is insane,4359
Krystal F.,im ready for freedom,4368
Talia I.,i cant see it on my phone can someone copy?,4371
Michelle R.,im confused tho still,4375
Rhonda K.,is there a cat generator that exists?,4379
Rhonda H.,that is the money right there i think,4404
Joy K.,he talked so fast,4415
Joy N.,type a if youre skeptical,4435
Kenya Q.,david same boat im taking the leap,4435
Joseph Y.,i think the price is real tbh,4436
Melanie T.,can we run more than one acct at a time?,4437
Angelica Y.,okay what do we do now,4440
Ese O.,i need this in my life,4447
Deandra W.,my old boss is gonna be mad,4453
Latoya E.,so crazy cant believe it,4469
Blessing S.,agreed!,4486
Chelsea M.,okay i'll bite,4486
Charles T.,gonna try it,4492
Talia J.,my cat needs an insta he is famous,4508
Shayla S.,wow he's selling,4510
Hauwa B.,can someone paste it so i can copy???,4512
Rhonda X.,this is insane,4517
Anthony L.,this dude is legit so far,4517
Veronica W.,i wish i saw this sooner,4526
David I.,did i hear that right???,4534
Kayla G.,okay lets do this,4535
Blessing L.,i trust him tbh,4538
Lakesha T.,my chat lagged out im so sorry,4541
Hauwa P.,link??,4542
Fatimah S.,he reads my mind it's crazy,4547
Olivia A.,this is unreal,4547
Latoya T.,i wanna get more time with my son,4549
Brooke Q.,my internet is so bad rn,4577
William W.,this is either heaven or hell,4580
Matthew W.,he is showing us exactly what we are gonna get,4589
Ese M.,fr?,4591
Brittany W.,lets goo,4627
Sierra B.,can we really make the clones?,4630
Kenya F.,i am done,4632
Kayla S.,thank you ben!,4639
Alexandria B.,you either swim or sink right,4645
Hauwa Q.,i love it,4652
John Q.,just tuning in what did i miss??,4655
Talia X.,yeah dude,4662
Hauwa G.,i was wrong,4673
Kendra U.,do we get customer service with this,4675
Lakesha X.,okay im actually interested rn,4676
Melanie G.,me too,4690
Ayo R.,oh no my credit card is in the other room,4691
Lilian Z.,def fr,4705
Destiny L.,this is where i'm gonna retire fr,4713
Charles U.,yeah dude,4724
Crystal L.,is this actually real lol,4737
Breanna J.,how long until i actually see stuff?,4739
Blessing Z.,im out of the rat race,4779
Jazmine V.,can i sign up with paypal?,4782
Chelsea O.,lets go!!!,4784
Samantha H.,i wanna sell my old comics online,4786
Diamond N.,yeah like 30 min he said,4786
Toni T.,where??,4791
Joy G.,thank you,4805
Blessing J.,did someone say they get a call,4817
David F.,great stuff thanks,4824
Thomas W.,where is the link omg,4827
Modupe N.,he is def a real dude,4828
Lisa D.,thanks so much,4832
Chelsea K.,where is the the link he said?,4847
Blessing Z.,where do we sign up btw,4860
David G.,no hes doing it with us,4879
Talia R.,wow hes gonna show us the whole thing,4880
Talia W.,i just wanna sell stuff,4883
Krystal K.,not pushy and calm,4888
Destiny D.,i wanna run a ghost writing biz with a.i. is this poss,4903
Ese X.,im a single mom and this changes everything wow,4909
Alexandria B.,this is the best product ive seen,4946
Tara D.,not a guru bs,4950
Kirsten I.,are you ready lads,4962
Kiara X.,i feel like i'm gonna pass out,4974
Breanna Q.,where is it all explained again??,4975
Alexis E.,he said limited time is it true?,4991
Kierra U.,amazing im in!,4993
Brianna M.,he is def confident,4997
John E.,this is fire,4999
Daniel W.,30 min?! ahhh,5006
Felicia O.,i need to make a life change asap,5011
Diamond P.,im getting paid,5015
Kenya I.,it can change our lives!!!,5016
David R.,done getting it!,5019
Kierra K.,awesome,5025
David C.,i am in,5032
David I.,this is what i need rn,5033
James F.,finally dude,5040
Michael Z.,time to change,5043
Brandi H.,help a brotha out with the link,5052
Anita B.,that's a good sign frfr,5060
Haven U.,wow i gotta run,5063
Ese I.,i had a bad experience with voice cloning,5069
Amanda Y.,why should i choose this over others,5082
Amanda U.,i might have missed it,5105
Matthew G.,this can change my life,5105
Chelsea Z.,no more empty promises please,5110
Latrice J.,link please,5118
Blessing U.,at the bottom or something??,5118
Anthony J.,he will say the same stuff next week too lol,5128
Ayo G.,i am tired of the same old bs,5129
Jada A.,okay let's change everything,5129
Veronica Z.,lol im gonna do it on the job,5155
James P.,the pain of regret is the worse than risk,5181
Amanda X.,please let this be real,5197
Kierra I.,wow this is intense guys,5212
Hauwa L.,finally legit stuff dude,5218
Grace Q.,my brain hurts,5221
Charles H.,i know this happens in all webinars,5227
Brittany L.,my kids need me lol byeeee,5229
Felicia U.,no scam,5231
Haven O.,what's the bonus again?,5232
Hauwa R.,what do u think?,5246
Carolyn N.,this is swim time for me,5247
Tara J.,okay im in also,5247
Kierra F.,so real dude,5250
Kendra C.,do i get support for this?,5252
Lisa V.,wow thats a lot,5253
Erica O.,he said it sounds so good i bet it does,5262
Krystal F.,he has the receipts lets goo,5273
Destiny Z.,omg,5290
Angelica J.,i have been in the ditch for too long bruh,5313
Haven F.,credit card lets go,5322
Krystal X.,thank you ben,5335
Sierra Q.,thanks so much!,5338
Crystal H.,where the chat be at lmao,5340
Kayla S.,wait so the a.i. writes and also posts???,5349
Kendra H.,we get all the upgrades too??,5363
Talia U.,all these questions running thru my mind its too much,5369
Stephanie M.,true,5383
Matthew S.,the a.i. finds influencers too???,5391
Dominique V.,let us know if you are pulling the trigger!!!,5417
Felicia O.,i keep missing it,5421
Tara D.,i wanna travel in peace so i think it's it,5427
Hauwa G.,im trying,5428
Stephanie U.,ahh,5429
Modupe P.,oh my god,5441
John F.,i dont wanna work at wendys anymore,5450
Kierra C.,we all gotta change our life right,5454
Stephanie O.,it sounds insane man,5460
Matthew Z.,is this legit even,5473
Ashley P.,see ya dude byeeee,5476
Chelsea K.,okay i'm gonna get it,5509
Shantel H.,the voice cloning i gotta see,5517
Lakesha J.,what if it takes all my money,5518
Dominique C.,im so ready lets goooo,5526
Alexandria F.,im gonna see what comes up,5538
Kiara X.,i thought it was just a sales pitch,5552
Shayla E.,do i need to buy ads?,5560
Kiara B.,all the fake a.i. clones sound so robotic,5571
William J.,me too!,5577
Nicole E.,wow that was great,5583
Crystal Q.,to the moon lads,5609
Lisa O.,i think its pinned to the top,5630
Alexandria C.,fr???,5694
Jazmine I.,i trust this guy so far,5701
Samantha J.,we are gonna retire lol,5702
Shayla R.,im so scared rn,5705
Brianna Y.,ok im ready for 100k accts,5724
Rhonda H.,greg you didnt think the same as me?,5727
Breanna H.,i think i need another cup of coffee,5728
Shayla X.,i wanna scale my jewelry biz,5730
Joseph L.,so good wow,5749
Latoya T.,thank you i cant wait to get started!!!,5769
Amanda B.,i am ready,5784
Brandi F.,no recurring costs wow,5787
John P.,it said only the first 50 get ben's affiliate training,5803
Ayo M.,so its basically a franchise without the franchise fee?,5805
Ayo D.,this seems like a no brainer at this price,5810
Kendra S.,this feels like a scam haha i hope it works,5812
Tiffany Q.,do i have to have my own domain?,5814
Haven K.,alright folks click that link,5818
Anita L.,okay im in thanks ben so pumped,5831
Chelsea N.,so what is the offer,5845
Amanda D.,so what are we doing now,5849
James T.,its like my dreams are finally coming true,5860
Kiara Q.,all this stuff for literally nothing,5865
Felicia W.,ready to work from home yass,5867
Latoya H.,thank you ben you are amazing wow!!,5868
Kiara J.,all thanks to you ben,5875
Ashley W.,who else is nervous and excited lol,5876
Thomas I.,so who else just upgraded lol,5877
Tara H.,just paid lets goooooo,5880
Brooke H.,paid lets do this!!!,5882
Crystal L.,wow only a two hundred sixty seven one time payment?,5884
Joseph J.,just bought im ready,5887
Rhonda D.,all set lets goooo,5891
Anita Q.,im so happy i found this today thank you,5891
Dominique Y.,just paid,5899
Erica Y.,i feel like im stealing,5904
Jazmine G.,thanks this is a gift,5910
Thomas Y.,where is the discount code again i missed it,5910
Latoya L.,i cant believe its not a monthly fee,5933
Jazmine Y.,paid mega bundle let's goo,5952
Chelsea F.,wow okay this is insane what a steal,5967
Latrice F.,awesome thank you!!!,5977
Daniel K.,cant beat this price thats for sure,5989
Jazmine U.,thank you thank you,6005
Erica Q.,lets gooo just pulled the trigger,6009
Sierra Q.,it even makes the content too wow,6025
Melanie I.,thanks ben this is worth it,6040
Latoya O.,this is truly next level,6048
Michelle G.,paid!,6048
Olivia Y.,paid here we go,6049
Stephanie T.,my mind is blown,6050
Kendra V.,my life has changed,6052
Kirsten R.,i dont want to work anymore,6060
Michelle S.,just in time wow,6062
Jasmine R.,cant wait to spend more time with my family wow!,6072
Haven Y.,i was hoping the price wouldnt be too crazy,6078
Brianna R.,paid this will change everything,6079
Breanna E.,this seems way better than buffer,6088
Fatimah P.,paid!!!,6101
Jada Q.,this is an insane deal wow wow,6122
Kayla I.,just upgraded this will be so awesome,6124
Kenya L.,what if i want to sell this to local biz?,6128
Robert B.,did i hear him right? does it auto-post?,6137
Krystal T.,yes!,6140
Shayla N.,finally no more manual posting,6143
Grace U.,mega bundle lets goooo,6145
Joseph N.,its like 5 apps in one or even more,6154
Diamond R.,benjamin please slow down hahaha,6155
Kiara N.,this is insane what a deal wow,6162
Brandi H.,im still confused about that mega bundle thing,6165
David Z.,i love this thank you so much,6168
Hauwa M.,paid lets do this,6172
Modupe F.,it feels like christmas,6175
Sierra F.,wow that was easy,6176
Melanie M.,i cannot believe its a lifetime deal,6180
Robert C.,is anyone doing a weight loss niche?,6181
Blessing L.,all right just signed up!,6182
Joseph G.,what happens after we pay,6186
Joseph G.,just grabbed the mega bundle,6190
Angelica T.,thanks so much i am ready to do this,6215
Felicia G.,just paid looking forward to getting started thanks,6224
Shayla S.,just bought lets do this,6235
Veronica H.,who else is doing the agency method,6239
Breanna L.,im ready to ditch those other tools,6254
Breanna K.,i feel dumb for buying those other softwares,6269
Blessing Q.,finally a business in a box,6291
Kayla B.,paid cant wait to use this!,6293
Jada N.,lets change our lives,6294
Lisa D.,this is like ten courses,6304
Amanda G.,wow crazy value,6307
Samantha R.,paid!!,6344
Lisa W.,thanks so much for this what a great offer,6345
Brianna X.,im excited,6346
Thomas R.,is this real life,6356
Tara L.,i dont even have a business right now,6391
Diamond V.,just upgraded lets do this,6393
Kendra E.,i had no idea instagram was this deep,6395
Dominique Z.,just signed up this is so worth it,6398
Modupe B.,this is going to be the best year ever,6399
Crystal A.,i am ready for this new adventure!!,6400
Alexis M.,paid ready to rock,6417
Stephanie K.,this year is my year,6420
Krystal L.,ive tried everything,6424
Jasmine Q.,ive been wanting to start an agency,6427
Carolyn T.,i can finally travel yay!!!,6432
Brittany L.,yess finally thanks again!!!,6434
Latrice O.,i am sarah lol,6439
Matthew D.,what else will this software work for?,6445
Kirsten J.,wow this looks amazing,6450
Angelica X.,mega bundle let's go!!!,6470
Lakesha E.,ok just upgraded to mega,6480
Michael Y.,he just explained it again ben,6492
Talia Y.,already paid,6495
Fatimah I.,just paid omg,6495
Modupe H.,did i hear him correctly about the money back thing,6500
Modupe A.,paid im stoked now,6504
Toni D.,my wife is gonna love this,6511
Rhonda X.,is it easy to cancel?,6528
Jazmine I.,wow he just said i could clone myself,6547
Stephanie N.,i dont want to miss out on that,6549
Daniel C.,just upgraded and ready to roll!,6578
Olivia M.,just secured mega lets goooo,6597
Modupe F.,the software looks easy enough,6601
Breanna Q.,wow you are a legend ben thanks for all of this,6608
Matthew L.,thank you ben this is the real deal,6618
Ese E.,you made my day man,6619
Joy W.,ive got goosebumps this is so cool,6621
John X.,omg just upgraded,6622
Samantha Z.,paid! this is amazing,6626
Toni Y.,dont miss out guys,6664
Destiny V.,wow i didnt even know there were different algorithms lol,6665
William W.,yeah im done with my job i cant wait,6665
Erica C.,im excited haha thank you!!!,6668
James D.,i just went all in yesss,6672
Kendra D.,ok ben this is insane thank you thank you!,6681
Sierra D.,this is actually legit,6699
Diamond J.,just made the payment,6709
Modupe U.,just went mega yass,6718
Jazmine C.,paid already set up,6722
Destiny J.,just upgraded here we go,6727
Chelsea I.,lets make money and change our lives yayy,6758
David G.,i just maxed my credit card lol,6759
Anthony X.,just signed up lets do this guys,6777
Toni D.,i dont see the chat link,6779
Veronica Z.,mega bundle locked in,6784
Grace H.,time to change my life haha,6796
Crystal M.,yeah it makes all the content guys,6798
Jazmine K.,paid thanks for all the help!!,6800
Rhonda U.,i like how this is meta approved thats cool,6806
James L.,wow ok wow what a deal omg,6809
Diamond S.,lets make money,6816
Sierra R.,just signed up looking forward to it!,6830
Latrice Q.,this is so easy i love it,6847
Latoya V.,just went mega cant wait to dive in,6848
Sierra U.,mega bundle thanks ben,6858
Brittany G.,this is gonna be awesome im so ready,6859
Erica M.,im ready to do this for reals,6879
Haven V.,jennifer its in the chat above hes posting it every few minutes,6881
Alexis L.,so ready to get these clients,6899
Robert R.,youre a lifesaver thanks ben,6905
Melanie F.,this is too good to be true,6907
Brittany G.,time to get out of the rat race,6910
Destiny C.,ready to gooooo,6924
Talia I.,did anyone not get the link,6928
Fatimah V.,who else already had their credit card ready lol,6934
Sierra O.,yes! ready to upgrade my life,6941
Deandra C.,omg a money back guarantee i am in,6944
Melanie Z.,alright im so pumped now,6944
Talia H.,just locked in the mega pack so great,6954
Kierra S.,what if i have no experience?,6961
Lilian T.,just upgraded im pumped,6964
Hauwa Z.,paid!!!,6981
Felicia B.,cant wait to finally see results,6983
Anita P.,okay im sold,6996
Robert E.,wow i was going to buy a course for 5000,7018
Anita J.,paid time to get my business going!,7020
Kierra I.,holy moly,7021
Grace Q.,what should i do first,7037
John F.,wow youve just made our lives easier thank you,7045
Brianna L.,this will finally make me productive haha,7046
Joy E.,ok im in,7059
Michelle P.,amazing just went mega this is too awesome,7059
Diamond F.,ben this seems like a gift lol,7076
Kendra G.,lets print money boys and girls,7102
Shayla Y.,its already better than chat gpt,7109
Erica T.,you all are gonna kill it this year,7109
Talia B.,i cant believe i get all of this for that price,7113
Fatimah O.,its all coming together,7117
Chelsea G.,ok mega bundle lets get it,7122
Joseph Q.,just paid im ready to learn!,7123
Charles X.,the price is insane,7123
Lisa I.,just grabbed the mega bundle,7135
Brandi B.,so what am i doing now after i buy,7138
Anita F.,just signed up this is unreal,7151
Tiffany D.,yall are making me want the mega bundle too hahaha,7154
Joy A.,is there a facebook group?,7154
Angelica B.,finally no more struggling with ads,7157
Chelsea K.,i had to get in before its too late,7161
Kiara Y.,paid yes thank you,7181
Toni P.,where to sign up?,7189
Ashley E.,just joined and ready for a fun new journey!!!,7192
Lilian F.,thanks so much for this i am so happy,7197
Hauwa G.,i cant wait for the training,7200
